{
  "property_name": "The Ritz-Carlton, Grand Cayman",
  "wifi": {
    "network_name": "RC-Guest",
    "password": "See in-room tablet"
  },
  "emergency_contacts": [
    { "label": "Front Desk", "extension": "0" },
    { "label": "In-Room Dining", "extension": "5100" },
    { "label": "Security", "extension": "5911" }
  ],
  "sections": [
    {
      "heading": "Dining",
      "entries": [
        { "name": "Blue by Eric Ripert", "description": "Fine dining seafood", "hours": "6:00 PM - 10:00 PM", "extension": "5200" },
        { "name": "Seven", "description": "Oceanfront breakfast & lunch", "hours": "7:00 AM - 2:00 PM", "extension": "5210" }
      ]
    },
    {
      "heading": "Amenities",
      "entries": [
        { "name": "Spa", "description": "Full-service spa & wellness", "hours": "9:00 AM - 7:00 PM", "extension": "5300" },
        { "name": "Fitness Center", "description": "24-hour access", "hours": "24 hours" }
      ]
    }
  ]
}
